Chasing Liberty,"What sad times we live in when a contemporary knockoff of Roman Holiday stars, in the place of the immortal Audrey Hepburn... Mandy Moore.",NEGATIVE
Chasing Liberty,The attempts at humor make a viewer long for the comedy and romance of Freddy vs. Jason.,NEGATIVE
Chasing Mavericks,"Not only beautiful to watch, but also occasionally inspirational.",POSITIVE
Chasing Mavericks,"Despite a number of exhilarating surfing sequences, the interesting true story of surf legend Jay Moriarty is transformed into another dull Hollywood biopic.",POSITIVE
Chasing Mavericks,"It's a relatively hackneyed drama, unable to turn the real-life story of young surfer Jay Moriarity (Johnny Weston) into a silver screen sizzler.",NEGATIVE
Chasing Mavericks,"Like waves beating on a shore, the guff just keeps on coming.",NEGATIVE
Cheaper by the Dozen,This dirty Dozen is incompetent at every turn and shameless on every level.,NEGATIVE
Cheaper by the Dozen,Remake bears no resemblance to the 1950 original.,NEGATIVE
Cheaper by the Dozen,The children (including creepy Hilary Duff) are 12 shades of dreadful.,NEGATIVE
Cheaper by the Dozen,"Like the middle Baker kids who fade into the background, Cheaper by the Dozen is pleasant and likable, but just not very exciting.",NEGATIVE
Cheaper by the Dozen 2,Cheaper by the Dozen 2 is so incredibly bland and by the numbers it's painful to watch ... it's just a collection of unfunny moments that are both uninteresting and annoying.,NEGATIVE
Cheaper by the Dozen 2,"I was convinced I was going to hate this film. But, it didn't bug me as much as I thought it would.",NEGATIVE
Cheaper by the Dozen 2,I think it should be considered child abuse to inflict this tripe upon children.,NEGATIVE
Cheaper by the Dozen 2,Martin and Levy mug for their close-ups and then retire to their trailers while the stunt doubles do the really hard work.,NEGATIVE
Chef,"A lightweight, but enjoyable film; an amuse bouche that may leave you hungry for something more substantial but still manages to satisfy.",POSITIVE
Chef,"When every conflict is quashed within minutes and the predicaments barely register concern, the power to affect audiences dwindles.",NEGATIVE
Chef,"The first time you do something it might be fresh and risky, but the tenth, twentieth, you risk becoming repetitive and bland. ""Chef"" is about a creative personality trying to break free from a system that fosters this repetition and stagnation.",POSITIVE
Chef,"Even in the most hungry moments, Chef, as a gastronomic comedy, never fails to feed our audiovisual appetite with all its idiosyncrasies. [Full review in Spanish]",POSITIVE
Chelsea Walls,"Linklater fans, or pretentious types who want to appear avant-garde will suck up to this",NEGATIVE
Chelsea Walls,...a disastrously ill-conceived drama...,NEGATIVE
Chelsea Walls,"As you may know, this film is directed by Ethan Hawke. Nicely shot, well acted, fine direction, well-organized (for what it is), but short on both impact and message.",NEGATIVE
Chelsea Walls,The film apparently takes place in a fantasy world where people in hotel hallways recite poetry in voice-over instead of speaking to each other.,NEGATIVE
Cherish,"A witty little thriller emerges as Zoe, under house arrest, resourcefully stretches her electronic anklet's restrictions.",POSITIVE
Cherish,"Robin Tunney turns Zoe's socialization and investigation into little revelations - sculpting her magnetic, melancholy presence as perfectly as her buff body in third-act action where she sheds, and draws, blood for a climax driven by robust reclamations.",POSITIVE
Cherish,This search for love and self worth is affectionately offbeat but strains as it plunges into violence.,NEGATIVE
Cherish,"Quirky, occasionally bizarre, often endearing, and -- despite its faults and uneven nature -- a true original.",POSITIVE
Chi-Raq,It's one of Lee's most accomplished and effective films in years&#46;,POSITIVE
Chi-Raq,Thrillingly ambitious musical satire from the legend that is Spike Lee.,POSITIVE
Chi-Raq,"""Chi-Raq"" is fiercely intelligent with its farcical parable and fearless in its vicious social commentary.",POSITIVE
Chi-Raq,"Powerful, preachy, maddening but ultimately unforgettable.",POSITIVE
Chicago,Not only for theater aficionados&#44; Chicago is a musical for people who don't even like musicals&#44; weaving its deliriously dark tale with enough cyanide-laced cynicism to win over folks who wouldn't know Oklahoma&#33; from Oh&#33; Calcutta&#33;,POSITIVE
Chicago,Chicago is quite the musical spectacle&#46;,POSITIVE
Chicago,A movie with a lot of things to say about the intersections among murder&#44; the media&#44; and fame &#40;20th anniversary&#41; ,POSITIVE
Chicago,"Not knowing what to expect was the best thing while approaching Chicago, its parallelistic storytelling is revolutionary and like few others I've seen in musicals. Full review in Spanish",POSITIVE
Child 44,A unique and compelling procedural that I found satisfying even in its messiness&#46;,POSITIVE
Child 44,With its pointedly non-Slavic cast&#44; Child 44 features an impressive roster of actors delivering muddled Russian accents&#44; leaving us to wonder what Espinosa has against today's native Russian talents&#63;,NEGATIVE
Child 44,"Despite several glaring issues, there's enough interesting stuff in Child 44 to merit your attention.",POSITIVE
Child 44,"Although the muddled, complicated subplots spin the film in too many directions to make Child 44 a truly successful adaptation of its source material, the allure of its leading performances are enough to make it worth a watch.",POSITIVE
Children of Men,"Children of Men is an achingly, almost dreamily optimistic film in the face of such brutally cynical conditions, offering a humanist message that neutralizes political debate. ",POSITIVE
Children of Men,Best Movie of the year. Cuaron just went to a whole new level with me. The class of filmmaking - the extended shots! those shots! my god! - here is astonishing.,POSITIVE
Children of Men,Alfonso Cuarón delivers a masterpiece that explores humanity and love in a world that's scarce of hope. [Full review in Spanish],POSITIVE
Children of Men,"As always, Michael Caine manages to steal every scene he's in with effortless, offbeat comedic charm.",POSITIVE
Chocolat,It is the performances that carry this film and there are enough interesting developments in the story to keep things moving&#46;,POSITIVE
Chocolat,Hallstrm should refrain from preachy parables and move on to an entre,NEGATIVE
Chocolat,Fabulous French fairy tale and romance for teens and up.,POSITIVE
Chocolat,It takes the radical stance that people should indulge their pleasures&#44; unless they're really mean&#44; in which case they should eat some chocolate and learn to be nice&#46;,NEGATIVE
Chopper,"The type of gritty independent film that isnt made anymore, besides the odd self-conscious copycat. Chopper is still delightful cinematic anarchy, with Bana offering a masterful performance that he hasnt matched since.",POSITIVE
Chopper,"Chopper is an intriguing film, one that challenges the viewer through unpredictable, often excessive violence set against a palate of folksiness and sporadic black humour.",POSITIVE
Chopper,"Wisely, the film doesn't attempt to find a psychological explanation, instead playing it for black comedy.",POSITIVE
Chopper,"It’s violent and shocking, but darkly funny.",POSITIVE
Christmas With the Kranks,"This exhausting parade of white people's Christmas problems offers only banality, blandness, and the most desperately unfunny sitcom hijinks imaginable.",NEGATIVE
Christmas With the Kranks,Allen was a bit low energy for my liking but actually came off better in his more sincere scenes towards the end of the film.,NEGATIVE
Christmas With the Kranks,"Forget the 12 Days of Christmas; there are at least 12,000 ways that 2004's fascistic Christmas with the Kranks earns the honor as the worst Yuletide film ever made.",NEGATIVE
Christmas With the Kranks,"Unoriginal, unfunny slapstick holiday fare.",NEGATIVE
Christopher Robin,"Disney has made another uninspired live-action version of a heartwarming character by relying on derivative ideas, and the result amounts to an unabashed cash-grab dependent on name-brand awareness.",NEGATIVE
Christopher Robin,"Children might not get it, although I'm sure they will enjoy the stuffed characters, but adults will understand the curious tale about the importance of old friends and embracing the inner child.",POSITIVE
Christopher Robin,Failures in cohesion and storytelling sensibilities abound.,NEGATIVE
Christopher Robin,An endearing movie for the whole family.,POSITIVE
Chronicle,Chronicle should be the shining example for any filmmaker or studio wanting to make a &#8220;found footage&#8221; movie that is more than just a gimmick&#46;,POSITIVE
Chronicle,There are some good lines in the picture&#44; and the final action sequence is fantastic&#46; It is just a shame that this &quot;fresh&quot; look at super-powers features so many things we ive seen before&#46;,NEGATIVE
Chronicle,"Chronicle is a truly innovative film that, out of nowhere, engages the needs of this genre with great enthusiasm. [Full review in Spanish]",POSITIVE
Chronicle,The found footage technique pays off for a crackerjack confrontational climax...,POSITIVE
Chuck & Buck,A detailed and often moving work&#46;,POSITIVE
Chuck & Buck,This bizarre and wonderfully abstract film is not to be missed.,POSITIVE
Chuck & Buck,"Creepy, funny, yet surprisingly affecting, Miguel Arteta's darkly comic drama pulls off a remarkable balancing act.",POSITIVE
Chuck & Buck,"Of all the films to premiere at Sundance 2000, there is one movie that best represented what indie film is supposed to be.",POSITIVE
Church Ball,Hale borrows from nearly every other irreverent sports film ever made.,NEGATIVE
Church Ball,"... a carefree, underdog sports comedy.",POSITIVE
Church Ball,"Its rowdiness, bathroom humor, cast of familiar but second-rate actors and overall disrespect for organized religion make it seem like any other bad Hollywood farce.",NEGATIVE
Church Ball,Air ball . . . Air ball . . .,NEGATIVE
Cinderella,There are moments of CGI animal nonsense that seem to exist completely separate from the live-action beauty Branagh has created&#44; and that awkward juxtaposition leaves the entire film feeling uneven&#44; at times admirable&#44; and at others condemnable&#46;,NEGATIVE
Cinderella,There really is no other word to describe this film other than enchanting.,POSITIVE
Cinderella,Cate Blanchett and Helena Bonham Carter give scene-stealing performances in this old-fashioned fantasy film.,POSITIVE
Cinderella,"A classic and beautiful movie that feels like old-fashioned Disney. There's an emphasis on the storytelling and fantasy, on good and evil all supported by sumptuous costumes and set decoration.",POSITIVE
Cinderella Man,"Giamatti gives a daring, bold performance that easily could have drifted into a cartoonish character.",POSITIVE
Cinderella Man,Even Howard and Goldsman's penchant for being over-sentimental doesn't scupper the emotional punch Braddock's story packs. That's largely down to Crowe's utterly convincing performance.,POSITIVE
Cinderella Man,"It ain't no Rocky, but it ain't half bad.",POSITIVE
Cinderella Man,The affection for Braddock and his story can be felt in every frame and heard in every word.,POSITIVE
Cirque du Soleil: Worlds Away,The movie version of Cirque Du Soleil comes alive when the troupe are showing off their stunts - it's just a shame about the bits in between.,POSITIVE
Cirque du Soleil: Worlds Away,The biggest flaw of Cirque du Soleil: Worlds Away is that it's not really a movie at all. It's more like a super-long commercial for the Canadian entertainment company.,NEGATIVE
Cirque du Soleil: Worlds Away,"...it's a tourism brochure, a very long, very sparkly infomercial for one-handed pushups...",NEGATIVE
Cirque du Soleil: Worlds Away,"Designed as pure confection for the eyes, this largely wordless fare is perfect for kids (how many G-rated films are there around?) and for any stressed-out office worker eager for something to unwind to.",POSITIVE
City by the Sea,"Ambitious, improbable and very violent cop drama.",POSITIVE
City by the Sea,The film ends up as shallow as the thankless love interest role Frances McDormand somehow agreed to play here.,NEGATIVE
City by the Sea,"If Rebel Without a Cause were told from the father's perspective, the result would probably be something like City by the Sea.",POSITIVE
City by the Sea,"We watch an esteemed actor discovering new nuances. In turn, it's a sublime reminder of the qualities that made Robert De Niro great, not a gimmick.",POSITIVE
City of Ghosts,"can be criticised of many things, but wasting locations and local talent is not one of them",POSITIVE
City of Ghosts,"The surprise is not necessarily that Dillon has a unique voice, but rather that the voice is so bizarrely dark and uninhibitedly exotic.",POSITIVE
City of Ghosts,There's nothing interesting about this half-baked noir plot...,NEGATIVE
City of Ghosts,"The movie fairly oozes with atmosphere, and its cast contains enough colorful characters to make Casablanca blush.",POSITIVE
City of God,&#8220;A gateway drug to world cinema &#8230; aesthetically pure&#8230; the world was bigger after I watched City of God&#46;&#8221;,POSITIVE
City of God,What is the value of human life&#63; And why are we so reckless with the fate of the youth of the world&#63; ,POSITIVE
City of God,"A cold, hard look at reality from a specific moment in time, specific place in the world and specific point-of-view. A brilliant film that shines in every department. [Full review in Spanish]",POSITIVE
City of God,"This Brazilian import is a dazzling achievement that marked Fernando Meirelles as a world-class filmmaker (his subsequent credit would be The Constant Gardener, the best film of 2005).",POSITIVE
City of Lies,"While the third act lacks oomph, the film lands its message of a corrupt police force where political self-preservation sadly overshadows the actual lives lost.",POSITIVE
City of Lies,"Moving back and forth in time, we see how a man got broken down for trying to do his job. It's good work for a near-disavowed film.",POSITIVE
City of Lies,The lesson is solid even as the huge production fails to generate the chemistry promised by its cast and crew.,POSITIVE
City of Lies,Johnny Depp is back in good form as an ex-cop seeking the truth about a famous murder. Forest Whitaker matches him step to step as an investigative reporter. A solid combination.,POSITIVE
Clash of the Titans,The filmmakers made a deliberate choice to modernize the story a bit&#44; but also tip their hat and incorporate a lot of these late 1970 is and 1980 is approaches to fantasy storytelling&#46;,POSITIVE
Clash of the Titans,"...you can't help feel that they spent so much time worrying how many dimensions the film should have, they forget how many the characters should.",NEGATIVE
Clash of the Titans,"The costumes, armor, castles, makeup, creatures, and special effects are all grander in scale than the predecessor.",NEGATIVE
Clash of the Titans,Even the special effects aren't exactly more impressive than they were in the original film.,NEGATIVE
Clean,Assayas handles the touchy topic judiciously and with remarkable panache.,POSITIVE
Clean,"It's a movie about bad choices and suffering the consequences and unfortunately, a lot of the suffering is done on the audience's side of the movie screen.",NEGATIVE
Clean,"Cheung makes her character work, despite a weak plot and script, both by director Assayas.",POSITIVE
Clean,While this somber drug-abuse drama contains few surprises -- it's pretty much what we've come expect to expect from such material -- Cheung's convincing performance as a drug addict is what makes it watchable.,POSITIVE
Clerks,&quot;Clerks&quot; doesn it feel as if it is trying too hard&#44; and that is its major charm&#46;,POSITIVE
Clerks,Though the individual parts &#8211; such as a few solid jokes&#44; outlandish characters&#44; and an outrageous quandary &#8211; tend to be more memorable than the whole&#44; this ultra low-budget&#44; independent project is undeniably impressive&#46;,POSITIVE
Clerks,After 22 years&#44; Clerks remains a quintessential part of 90s independent cinema&#44; and the start of the career of one of the most well-rounded directors and writers of this era&#44; Kevin Smith&#46; ,POSITIVE
Clerks,"The acting is a bit amateurish at times. But when dialogue like Randall's monologues -- piercing and brutally fresh -- are presented to the audience, all is forgiven.",POSITIVE
Clerks II,Like so many passion projects from filmmakers without much oversight&#44; it often feels as if the cast is having more fun shooting the picture than audiences could possibly have while watching it&#46;,NEGATIVE
Clerks II,"Finally, a storyline came to him that made sense.",POSITIVE
Clerks II,"Notably dubbed as the ""gayest film ever"" when it premiered at Cannes, ""Clerks II"" is nonetheless a slight improvement on Smith's original film.",NEGATIVE
Clerks II,&quot;Clerks II&quot; will resonate with viewers in Smith's age range &#40;mid-thirties&#41; in a way that goes beyond comedy&#46;,POSITIVE
Click,"Despite all its inherent flaws and challenges, what can I say? It clicks.",POSITIVE
Click,The film has its moments where it attempts to teach us about priorities and what should be important in our lives.,POSITIVE
Click,A remote-control gizmo allows Adam Sandler to skip all of life's bad stuff and blows the whistle on current culture's instant-gratification laziness. It'll teach your kids to learn to take the bad with the good.,POSITIVE
Click,"A catchy little idea for a comedy catches a bad attack of the sads at the halfway mark, where the filmmakers mistakenly think it's time for some drama and a few lessons about the human condition.",NEGATIVE
Clifford the Big Red Dog,"A genuinely lovely and endearing re-entry into the Clifford universe, wherein once again we learn what it might be like to own a small puppy that inexplicably grows up to become a 4-metre-high pooch.",POSITIVE
Clifford the Big Red Dog,"Watching as an adult, Clifford the Big, Red Dog is sweet, cute, mildly humorous and a bit of innocent fun.",POSITIVE
Clifford the Big Red Dog,"It feels like one of those live-action Disney features that were so prevalent during the 1970s -- one could easily picture Jodie Foster as the prepubescent heroine, Dean Jones as her bumbling uncle, and Don Knotts as the supremely self-satisfied villain.",POSITIVE
Clifford the Big Red Dog,"All up, it's a spirited and unpretentious film with some engagingly eccentric bits, the best of which involve Izaac Wang.",POSITIVE
Clockstoppers,The best thing to do with Clockstoppers is to make like Zak: Put it into hypertime (aka fast-forward) until you get to the good parts.,NEGATIVE
Clockstoppers,Fun action comedy with nifty special effects.,POSITIVE
Clockstoppers,Visually exciting sci-fi film which suffers from a lackluster screenplay.,NEGATIVE
Clockstoppers,Director Frakes steps triumphantly into the ring of Hollywood mediocrity with this effort...,NEGATIVE
Closed Circuit,"Circuit had the potential for conveying its cinematic trade as an emotional vacuum for insinuation, interrogation, infiltration and ideology. Instead, it swoops up the lint of an arbitrary character-driven thriller that tediously talks",NEGATIVE
Closed Circuit,"As it is, despite being extremely well-acted, it's just another OK spy thriller to add to the pile.",POSITIVE
Closed Circuit,"Everything does work harmoniously for the majority of Closed Circuit, to create the exact taut mystery of governmental corruption and legal system loopholes I desired.",POSITIVE
Closed Circuit,The progressively intriguing atmosphere is heightened by the inclusion of several standout sequences&#46;&#46;&#46;,POSITIVE
Closer,"Clive Owen gives the deepest and most emotionally nuanced performance as a dermatologist desperate for love and loyalty, and Natalie Portman is a close second as the coy stripper beholden to Jude Law's self-centered, stalled writer.",POSITIVE
Closer,"Each frame of the film seems infused with vibrant life, even when the tone switches from dark to darker.",POSITIVE
Closer,"For all its stunt casting and knee-jerk sexual frankness, Closer gives an underlying resonance to an emotional world that is normally the preserve of glossy soap operas.",POSITIVE
Closer,"The heart isn't a fist any more than the hand is a foot, and anyway there's no fist so tight that doesn't unfold into an open hand sometime. The movie is like a comedy someone dipped in a solvent.",NEGATIVE
Cloud Atlas,Cloud Atlas will confound and maybe even aggravate some unwilling to&#44; quite simply&#44; &#8220;go with the flow&#46;&#8221; But others will find what few have&#58; a bold&#44; technically awesome&#44; and thematically enduring picture whose arrangement and ambition are unprecedented&#46;,POSITIVE
Cloud Atlas,It is a highly ambitious picture that pulls off an incredibly clever storytelling technique&#46; But it could also be viewed as a three-hour grind that features many of the Wachowski is familiar self-indulgences&#46;,NEGATIVE
Cloud Atlas,I was hypnotized by Cloud Atlas.,POSITIVE
Cloud Atlas,Its a film unlike any other ever madeone that explores the fluidity of sexuality and genderand a thrilling cinematic experience. The Matrix may have put the Wachowskis on the map. Cloud Atlas proves their real brilliance.,POSITIVE
Cloudy With a Chance of Meatballs 2,"The movie's imagination, inventiveness and humor are its selling points.",POSITIVE
Cloudy With a Chance of Meatballs 2,Sony Pictures Animation certainly knows how to make an entertaining animated feature.,POSITIVE
Cloudy With a Chance of Meatballs 2,"While the kiddos will initially be entertained by how all of this is presented, the likelihood is that both children and adults will quickly tire.",NEGATIVE
Cloudy With a Chance of Meatballs 2,"The characters are actually better rounded this time and evolve in fun ways. Now that they're all together, the dynamic of the film is much more fun and lighthearted.",POSITIVE
Cloverfield,Director Matt Reeves and writer Drew Goddard effectively tap into that decade is post-9&#47;11 anxieties&#46;,POSITIVE
Cloverfield,Remains one of the better entrees in the early-aughts found-footage boom &#40;15th anniversary&#41; ,POSITIVE
Cloverfield,A fun and well-made return to the monster movie genre&#46;&#46;&#46;,POSITIVE
Cloverfield,"Cloverfield is quite a stunning, fresh use of the found footage concept which cleverly updates the Godzilla-concept.",POSITIVE
Coach Carter,&#46;&#46;&#46;a decent-enough inspirational sports drama&#46;&#46;&#46;,POSITIVE
Coach Carter,"Despite the attraction of fluently filmed basketball sequences, director Thomas Carter's simplistic approach to the social and educational issues involved makes this vacuous MTV-produced movie fall well short of the basket.",NEGATIVE
Coach Carter,A quality sports drama.,POSITIVE
Coach Carter,"With subplots about pregnant girlfriends, drug-dealing cousins, and other sob stories that are mentioned but not developed, Coach Carter's exceptional message is delivered with little imagination.",NEGATIVE
Coco,A fine addition to the Pixar legacy&#8230; a very sweet film about family&#44; very thoughtfully put together&#46; It has that unmistakable mixture of comedy and sentiment that you associate with a Pixar movie&#46; Great fun&#46; ,POSITIVE
Coco,"Coco is a film that reminds us of the effect and importance of mise-en-scène, even when it has been assembled by animators and computers.   ",POSITIVE
Coco,The film falls in line with some of Pixars best films and is an absolute must watch for any fan of film especially the Latino community&#46; Coco gives the community more reason to be proud to be Latino&#46;,POSITIVE
Coco,"Coco is another brilliant installment into an already near flawless collection of films (okay, all but those Cars movies).",POSITIVE
Code 46,"High on atmosphere and big on ideas, but quietly goes about its business otherwise.",POSITIVE
Code 46,"a visually striking, but emotionally flat mash-up of romantic drama, film noir, and science fiction that sounds much more interesting than it turns out to be",NEGATIVE
Code 46,Disappointing sci-fi that's too intense for kids.,NEGATIVE
Code 46,A luxurious sight to behold.,NEGATIVE
Code Name: The Cleaner,"Code Name: The Cleaner isn't the worse comedy ever made; it probably won't even be the worst of 2007. For the most part it's simply boring, with fleeting patches of ineptness.",NEGATIVE
Code Name: The Cleaner,Depressingly laugh-free comedy that's so irredeemably awful that you'll wonder why Martin Lawrence isn't in it.,NEGATIVE
Code Name: The Cleaner,"If you like comedies but hate going to the trouble of actually laughing, then this might just be the movie you've been waiting for.",NEGATIVE
Code Name: The Cleaner,"The sooner Code Name... gets flushed out of cinemas, the better.",NEGATIVE
Cold Comfort Farm,"[A] mischievous send-up of D.H. Lawrence, Thomas Hardy and assorted other high-toned practitioners of grimly serious rural romances.",POSITIVE
Cold Comfort Farm,The film is full of wonderful eccentrics and funny performances.,POSITIVE
Cold Comfort Farm,"""Cold Comfort Farm"" may be hysterically funny to regular readers of Hardy, Lawrence, Jane Austen and the Bronte sisters, but it won't ring many bells for the rest of us.",NEGATIVE
Cold Comfort Farm,Falls flat on its bum.,NEGATIVE
Cold Creek Manor,Talk about your fixer-upper - the script needs fixer-uppering.,NEGATIVE
Cold Creek Manor,There are no surprises at all in this totally predictable mistake of a movie.,NEGATIVE
Cold Creek Manor,"Director Mike Figgis also composed the score, which during the tense scenes merely sounds like a two-year-old incessantly banging on random piano keys.",NEGATIVE
