Invictus,It is a film that will likely entertain both history buffs and fans of sports films.,POSITIVE
Invictus,Freeman was born to play his friend Mandela in Eastwood's inspiring movie.,POSITIVE
Invictus,"There's plenty here to keep the interest for most, and the performances, particularly Freeman's, are excellent.",POSITIVE
Invincible,"By the time Papale does make it the big game, it's as if the air goes out of the movie and all Core can do is punt.",NEGATIVE
Invincible,"Edifies Herzog's preoccupation with blurring the distinction between performance and naturalism, fiction and documentary.",POSITIVE
Invincible,A unique visual work.,POSITIVE
Invincible,"...the naivete of his performance has a humbling effect on a film that, while entirely too long and short on sizzling imagery, is meant to be taken simply as folkloric.",POSITIVE
Iris,"This in an informative, well-acted biopic of a woman whose life's work deserves to be preserved and remembered.",POSITIVE
Iris,"Admittedly, it's hard not to be affected.",POSITIVE
Iris,"Despite good acting from the two pairs, viewers expecting illuminating insights about the literary genius, eccentric philosophy and complex sexuality of Iris Murdoch will be disappointed by Richard Eyre's minor, rambling, TV-like film.",POSITIVE
Iris,"...Iris isn't necessarily an enjoyable piece of work, though it's certainly interesting...",POSITIVE
Iron Man,An exceptionally well-made debut for Marvel Studios&#46; Fun&#44; engaging and bolstered by a tour-de-force lead turn by Robert Downey Jr&#46;,POSITIVE
Iron Man,A fun two-hours thanks to a top cast lead by a charismatic Robert Downey Jr. Most of the effects still hold up and the action scenes are still exciting.,POSITIVE
Iron Man,"If you don't like Iron Man, then you should stop going to movies.",POSITIVE
Iron Man,"This is Downey at the top of his game, delivering a performance full of humor and self-awareness.",POSITIVE
Iron Monkey,"As a perfect complement to the adventure, a generous portion of comedy is blended in - sometimes just with witty bits of dialogue and frequently with physical slapstick.",POSITIVE
Iron Monkey,"Where Iron Monkey really comes alive is with the action, and here's where the audiences who enjoyed Crouching Tiger are repaid ten-fold.",POSITIVE
Iron Monkey,"some of the finest martial arts displays imaginable, and it doesn't take itself seriously",POSITIVE
Iron Monkey,"Despite it's tonal split personality, Iron Monkey is a fun Hong Kong martial arts action-comedy that offers a heck of a climax.",POSITIVE
Isle of Dogs,The huge and talented cast offer up superb voice work&#44; and they all meld seamlessly into Anderson is handsomely idiosyncratic world&#46;,POSITIVE
Isle of Dogs,"It's perhaps too easy for the viewer to become lost in Anderson's creativity, as opposed to becoming lost in the emotional power of the storytelling, and so Isle of Dogs feels less engaging than his previous output.",POSITIVE
Isle of Dogs,"Isle of Dogs is a perfect film for dog lovers, or maybe just animal lovers in general. It expresses the special bond and friendship between humans and their pets. Wes Anderson realizes these ideas with an amazing, unique flare.",POSITIVE
Isle of Dogs,"Meticulously crafted, well-acted and often hilarious.",POSITIVE
It,The film is just as much an evocation of troubled adolescence as it is a horror romp featuring a malevolent clown&#46;,POSITIVE
It,"When the scary things emerge from the dark and turn out to be digital specters, it's not all that terrifying. More effective is our investment in the characters and their fates.",POSITIVE
It,It like Pennywise is a being of its own - a blend of The Goonies and A Nightmare on Elm Street&#46; ,POSITIVE
It,"The production, the performances, the visuals, the story, the horror, and everything else gels together into one of the best Stephen King movies ever made.",POSITIVE
It's Kind of a Funny Story,"Features an exceptional cast, a sensible blend of dark humor with dramatic overtones, and the inclusion of several creative fantasy sequences.",POSITIVE
It's Kind of a Funny Story,"Galifianakis proves himself as an actor here, and Gilchrist and Roberts will surely be going places. It is a feel-good movie despite the subject matter.",POSITIVE
It's Kind of a Funny Story,"An uneven film, and its earnestness is a bit stretched, but its characters are mostly oddly endearing.",NEGATIVE
It's Kind of a Funny Story,Galifianakis [is] able to turn on a dime; balancing his disarming humour with moments of anguished outbreaks. His is one of the best supporting performances of recent memory; equally funny and heartbreaking. If only I could say the same of the movie.,NEGATIVE
It: Chapter Two,"It Chapter Two is a good conclusion to the Losers Club story. It definitely has more Stephen King flair than the first film, but gives you everything you’d want from a supernatural horror. ",POSITIVE
It: Chapter Two,Too many things weigh the movie down and keep it from resonating like the first chapter&#46; And too much time is squandered in the wrong places&#46;,NEGATIVE
It: Chapter Two,"Despite the luxurious 170-minute runtime, Chapter Two feels hastily assembled, oddly brief and bloated at the same time, and beneath the text on which it was based.",NEGATIVE
It: Chapter Two,Episode 48: Ready or Not / It Chapter Two / Women on the Verge of a Nervous Breakdown,NEGATIVE
J. Edgar,By the end&#44; we don it understand Hoover any more than we did when the film began&#46;,NEGATIVE
J. Edgar,"File under fascinating, but seriously flawed.",NEGATIVE
J. Edgar,An exquisitely made piece.,POSITIVE
J. Edgar,A well done biopic featuring a couple of fine performances from DiCaprio and Hammer.,POSITIVE
Jack Reacher,Other characters keep telling us how mysterious and dangerous Jack Reacher is&#44; and yet Cruise is appearance&#44; clean-cut and trim&#44; doesn it fit the bill&#46;,NEGATIVE
Jack Reacher,"Im not sure what level of recommendation it is when you say a film was better than you thought it would be, but there it is. ",POSITIVE
Jack Reacher,Both a competent mystery movie and an exciting action film.,POSITIVE
Jack Reacher,There's quite a bit of fun to be had in the film if you're willing to lower your expectations.,POSITIVE
Jack Reacher: Never Go Back,Despite the efforts of Cruise and Smulders&#44; things never rise above predictable and&#47;or formulaic&#46;,NEGATIVE
Jack Reacher: Never Go Back,"Exclusively suited for those with a particular interest in this intellectual property, especially given the low-rent quality of the story and production.",NEGATIVE
Jack Reacher: Never Go Back,"A kind of grittier cousin to the Mission: Impossible films, Never Go Back doesnt stray much from the Tom Cruise action formula, but that will be just fine for most.",POSITIVE
Jack Reacher: Never Go Back,"It's a shame Popstar arrived in theaters first, because a better title for the dreary Jack Reacher: Never Go Back would have been Jack Reacher: Never Stop Never Stopping.",NEGATIVE
Jack Ryan: Shadow Recruit,Clear and present slumber&#46;,NEGATIVE
Jack Ryan: Shadow Recruit,Is this a formula that we ive seen before&#63; Absolutely&#46; But when I im enjoying myself&#44; I just don it care&#46;,POSITIVE
Jack Ryan: Shadow Recruit,The film and story aren it as dense or involving as the author is books or previous book adaptations&#44; but Paramount has delivered a worthy franchise restarter&#46;,POSITIVE
Jack Ryan: Shadow Recruit,"With all the poor choices the film makes, I have to say I was never bored.",POSITIVE
Jack and Jill,Jack and Jill is painfully tedious and sophomoric&#46;,NEGATIVE
Jack and Jill,Sandler manages to create one of the most obnoxious and unfunny characters to go with this obnoxious and unfunny film&#46;,NEGATIVE
Jack and Jill,"Sandler is hit-and-miss here, with a definite miss virtually every time he shows up as Jill.",NEGATIVE
Jack and Jill,I'm not saying we SHOULD take Pacino's Oscar away from him because of this movie. I'm just saying that's a conversation I'm willing to have.,NEGATIVE
Jackass 3,"...something of an anarchic spirit worth celebrating too, no matter how small and no matter how puerile.",POSITIVE
Jackass 3,These guys are the taunting yet fiercely loyal friends we've kind of always wanted in our lives.,POSITIVE
Jackass 3,I think a blanket apology to both audiences and the cast themselves would be more appropriate - it should never have come to this.,NEGATIVE
Jackass 3,"Jackass 3D is incredibly stupid, but it's also hands down one of the funniest and most entertaining movies I've seen all year. Anyone who thinks differently just doesn't have a sense of humor and needs to lighten up a bit.",POSITIVE
Jackass Presents: Bad Grandpa,"Amidst all the chaos and naughtiness, there's an unabashed celebration of the human spirit here that left me simultaneously laughing and crying.",POSITIVE
Jackass Presents: Bad Grandpa,You can laugh at poop and fart jokes for only so long; sooner or later all the pooping and farting will start to stink.,NEGATIVE
Jackass Presents: Bad Grandpa,"With his 8-year-old grandson riding shotgun, Knoxville just keeps on punking the real world with carefully constructed shonky shenanigans. Do not try this at home. Do feel free to laugh.",POSITIVE
Jackass Presents: Bad Grandpa,"Bad Grandpa offers a whole lot of moments that will make you laugh, make you feel bad about laughing and then make you laugh again.",POSITIVE
Jackass: Number Two,Every incorrigible ne'er-do-well's dream come true.,POSITIVE
Jackass: Number Two,"Either this film is different, I am different or the gang just got me in the right space to view the film.",NEGATIVE
Jackass: Number Two,"I'll admit, this is an acquired taste. I wasn't a fan of the original, but this time I appreciated the humor for what it was: extremely lowbrow.",POSITIVE
Jackass: Number Two,"Johnny Knoxville, Bam Margera and company prod themselves into a hilariously fascinating exploration, and exploitation, of their own psychological fears. After all, a director like Spike Jonze wouldn't be a hanger-on if there were no subtext.",POSITIVE
Jackass: The Movie,"I can accept that many find this entertaining, however, I'm just not one of them.",NEGATIVE
Jackass: The Movie,More idiotic and dangerous than the show. Really.,NEGATIVE
Jackass: The Movie,"Superficial shenanigans don't diminish its effect. It's a ridiculously funny barrage of taboo pranks, practical jokes and tests of both social altruism and Bam Margera's parents' patience - most of it failsafed so that the foolishness never subsides.",POSITIVE
Jackass: The Movie,The movie is designed to play for one audience and one audience only: existing Jackass fans.,NEGATIVE
Jackpot,The Polish brothers are clearly talented; all they need now is a story that's more interesting than this one.,NEGATIVE
Jackpot,The Polish brothers are onto something about their view of small-towns in the western part of America...,POSITIVE
Jackpot,"""Jackpot"" is a downbeat but effective character study ...",POSITIVE
Jackpot,"For anyone interested in a movie that wipes clean the grungy patina of self-delusionment, Jackpot hits solid pay dirt.",POSITIVE
Jane Eyre,The story is anchored by some wonderful performances&#44; great costume and set design&#44; and it is moody yet captivating cinematography&#46;,POSITIVE
Jane Eyre,The film should only cement the growing reputation of Wasikowska.,POSITIVE
Jane Eyre,This Jane Eyre adaptation far surpasses any of the previous film versions by benefiting from a master execution by director Cary Fukunaga. [Full review in Spanish],POSITIVE
Jane Eyre,It really is hard to find a fault with this latest adaptation of Jane Eyre. It's certainly one of the most tonally stringent period films of recent years.,POSITIVE
Japanese Story,An underdeveloped film that requires all of [Collette's] ample skills merely to rise to the mediocre.,NEGATIVE
Japanese Story,A heartbreaking and complex film about human relationships.,POSITIVE
Japanese Story,"Lots of pictures begin strongly only to lose their focus; this one gains momentum with every sequence -- ambivalent at first, we're firmly hooked by the final frame.",POSITIVE
Japanese Story,"Mixing cultural comedy, survival tension, unlikely romance and an extreme about turn, it's a moving and unusual film.",POSITIVE
Jason Bourne,It is a bit slow out of the gate&#44; but when it gets its footing it falls right in line with the franchise&#46;,POSITIVE
Jason Bourne,"When it's made with the level of energy that Greengrass applies, it's difficult not to be entertained.",POSITIVE
Jason Bourne,While the weakest of the original three&#44; Jason Bourne is still entertaining and good enough to warrant the price of admission&#46;,POSITIVE
Jason Bourne,"Jason Bourne is more indecipherable and unformed than ever, with Damon not given much more to do than shoot, brawl, bleed and run.",NEGATIVE
Jason X,It's not a good movie. Literally no one expects Jason X -- the 10th sequel in the Friday the 13th series -- to be good.,NEGATIVE
Jason X,"There's a lot of dumb fun to be had here, so it only sucks on a few levels.",POSITIVE
Jason X,I had forgotten why I only remember the trailer for this dumb horror movie. [Full review in Spanish].,NEGATIVE
Jason X,"Although Jason X didn't achieve nearly the popularity that follow-up Freddie vs. Jason did, it's overall a better film with more imagination... funnier lines and more gnarly kills.",POSITIVE
Jayne Mansfield's Car,Zany but strained period piece dramedy.,NEGATIVE
Jayne Mansfield's Car,"Jayne Mansfield's Car is dramatic and funny and entertaining in many parts, but the jigsaw puzzle doesn't always flow from piece to piece. For all of Thornton's directing skill, the overall film can be episodic and loses focus repeatedly.",POSITIVE
Jayne Mansfield's Car,The truly superb cast of Jayne Mansfield's Car sputters in this confused melodrama that is more pre-occupied with explicitly saying everything rather than genuinely saying something.,NEGATIVE
Jayne Mansfield's Car,It's obvious that Billy Bob Thornton is attempting something meaningful with Jayne Mansfield's Car. It's just tough to figure out what it is.,NEGATIVE
Jeepers Creepers,There's a menace to it that creates a lot of tension&#44; and the direction makes all the right moves&#44; but the proverbial &quot;big reveal&quot; makes the whole thing seem more than a little ridiculous&#46;,NEGATIVE
Jeepers Creepers,There's little doubt that Salva delivers an almost astonishingly effective opening stretch&#46;&#46;&#46;,POSITIVE
Jeepers Creepers,"An absurd horror yarn in which a cannibalistic winged demon goes on a murderous rampage whenever he hears the title tune. Personally, ""Sussudio"" and ""Rude"" are the only songs that would conceivably make me take a hatchet to someone's head, but I digress.",NEGATIVE
Jeepers Creepers,A good way to find some genuinely creepy moments in a decade where they were short in supply.,POSITIVE
"Jeff, Who Lives at Home",Audiences are bound to fall for Segel is teddy bear sweetness and the genial way the characters manage to work out their problems&#46;,POSITIVE
"Jeff, Who Lives at Home",Judy Greer also turns in what may be a career best performance.,POSITIVE
"Jeff, Who Lives at Home","[The Duplass brothers'] best film to date. In fact, this post-Mumblecore endearing effort from the directing duo happens to be one of the most funny, touching, and entertaining films of the year as well.",POSITIVE
"Jeff, Who Lives at Home","Part mumblecore kitchen sink drama, part paranormal detective story, this sibling bromance adds a fresh and engaging approach to the domestic comedy template.",POSITIVE
Jersey Boys,&#8230;a straight bio-pic&#44; with diegetic music only either as the soundtrack to montages or when the band perform&#8230;,POSITIVE
Jersey Boys,Eastwood is firmly established love of music doesn it necessarily mean he is attuned to the snappy&#44; energetic presentation this production required to both channel the Broadway show and ensnare moviegoers&#46;,NEGATIVE
Jersey Boys,"Like a coin-operated jukebox that relies on push buttons, stacks of vinyl and electric inner workings to make music, Jersey Boys feels like a mechanical retelling of the popular Broadway show.",NEGATIVE
Jersey Boys,You'll likely be so caught up in the film's catchy music and spirit that you won't much mind occasional liberties and factual errors.,POSITIVE
Jersey Girl,This film should have been much better than it is.,POSITIVE
Jersey Girl,A gem that is bound to be misconstrued.,POSITIVE
Jersey Girl,Director Kevin Smith's first non-View Askewniverse effort...,POSITIVE
Jersey Girl,"But the formulaic nature of ``Jersey Girl'' and its unabashed embrace of suds makes it awfully sweet stuff. ``Jersey Girl'' is [Kevin] Smith at his most tender but not, alas, at his most original.",NEGATIVE
Jesus' Son,Alison Maclean takes an uncommon approach to a common theme and comes up with a film that is nothing short of a revelation.,POSITIVE
Jesus' Son,takes some different turns,POSITIVE
Jesus' Son,"JESUS' SON is bottom of the line trash that wants to be art. Full of self important crap, tedious performances, and embarrassing experimental flourishes, this is a movie to avoid at all costs.",NEGATIVE
Jesus' Son,"While one is able to get interested in FH's internal workings, it's more difficult to get too invested in his external actions--that is, on rare occasion he does act rather than react.",NEGATIVE
Jet Lag,"While the movie is unfolding, you don't mind being persuaded by its benevolence and gracefulness.",POSITIVE
Jet Lag,"Charming in its predictability, yet not without its pleasures. The leads share a very casual chemistry, an odd couple that refreshingly isn't at odds with each other.",POSITIVE
Jet Lag,"In the realm of predictable rom-coms, this one has enough charm and humor to divert us for an hour and a half.",POSITIVE
Jet Lag,"The idea of gruff, scruffy Reno and the elegant- as-ever Binoche getting together is far too ridiculous to swallow even for a minute.",NEGATIVE
Jigsaw,"Gorehounds will get their fill, and that's about the limit of Jigsaw's appeal.",NEGATIVE
Jigsaw,Jigsaw will in no way&#44; shape or form be a game changer for the horror genre&#46;,NEGATIVE
Jigsaw,"""The horror genre typically sees women as passive and helpless, the perfect victims. But when the roles are reversed, a female killer reclaims some power.""",NEGATIVE
Jigsaw,"Though slicker and better-directed than any prior Saw film, Jigsaw's tame gore and rehashed plot twists make it mostly fall flat.",NEGATIVE
Jimmy's Hall,Ken Loach has fashioned one of his purest and most lovely films here in Jimmy's Hall.,POSITIVE
Jimmy's Hall,"The film feels flat, self-consciously preachy and not a patch on my own favourite, Land And Freedom.",NEGATIVE
Jimmy's Hall,"Barry Ward's handsome, charismatic hero is a romanticised figure (in reality Gralton was middle-aged and balding), which wouldn't matter if his character had been given more depth and shade.",NEGATIVE
Jimmy's Hall,"A handsomely mounted, yet modest and precise piece of work that unearths a little-known true story of injustice and reminds us all of how the present is always in the shadow of the past.",POSITIVE
Jindabyne,"Subtle and understated, a meditation on morality, mortality and murder that escalates into a small emotional powerhouse.",POSITIVE
Jindabyne,"Although Jindabyne's cinematography features sweeping scenes of the Australian countryside as stunning as any of those opening shots from Brokeback Mountain, it ultimately has some bigger issues.",NEGATIVE
Jindabyne,Less a moral dilemma than a meditation on the differences between men and women in matters of social decorum.,POSITIVE
Jindabyne,Intense relationship drama for adults only.,POSITIVE
Joe Dirt,"In place of anything resembling a plot, the movie wheels-out a tired collection of set-piece gross-outs for Joe to endure.",NEGATIVE
Joe Dirt,"Crass, formulaic comedy with bullying, cartoonish violence.",NEGATIVE
Joe Dirt,...none of it is funny.,NEGATIVE
Joe Dirt,"Sally forth, gentle viewer, and enjoy yourself. En route, you will experience a steady supply of doo-doo jokes, dispensed in seven-minute intervals by the Script-O-Tron 3000TM.",NEGATIVE
Joe Somebody,Talented actors are wasted on bad script.,NEGATIVE
Joe Somebody,Much of the running time is devoted to dramatic subplots and other such misguided attempts at pathos.,NEGATIVE
Joe Somebody,There is a definite threat behind this man's eyes.,POSITIVE
Joe Somebody,"Bearing clear marks of a film made strictly to pay the bills, its performances are phoned in and its direction is eminently average.",NEGATIVE
John Carpenter's Ghosts of Mars,A fun and underrated movie deserving of any Carpenter fan is affection&#46;,POSITIVE
John Carpenter's Ghosts of Mars,"...the public didn't get it, but Ghosts of Mars has great action scenes, some cool tension, and funny dialogue...",POSITIVE
John Carpenter's Ghosts of Mars,"No one's favorite John Carpenter movie, least of all Carpenter. But it's much like Carpenter's Jack Burton character - amusingly cocksure in its constant clamoring, prone to the wrong place at the wrong time, similarly accidental in success it finds.",POSITIVE
John Carpenter's Ghosts of Mars,"With the synthesizer-heavy soundtrack, practical gore effects, and macho attitudes, the film is instantly recognizable as a work by director John Carpenter.",NEGATIVE
John Q,I liked this movie but some of the performances like Eddie Griffin threw the tone off a bit&#46; But all in all&#44; Denzel does such a great job in this film and does everything he can to carry it to the finish line&#46;,POSITIVE
John Q,Denzel carries this movie on his back&#44; which saves the movie from fully drowning&#46; It should've been a great Denzel movie but because of its flaws&#44; it is just &quot;ok&quot;&#46; ,POSITIVE
John Q,Thought-provoking. Too intense for young teens.,POSITIVE
John Q,"Strands good actors in mushy, movie-of-the-week material. [Blu-ray]",NEGATIVE
John Tucker Must Die,The only one who's getting screwed over in this film is the audience.,NEGATIVE
John Tucker Must Die,"Designed as an ultimate revenge fantasy ""John Tucker Must Die"" is a moderately funny teen comedy with a few flashes of bawdy humor.",NEGATIVE
John Tucker Must Die,"Rarely has a title promised so much, and delivered so little. John Tucker Must Die is toothless, gormless, witless, and, worst of all, deathless.",NEGATIVE
John Tucker Must Die,"Had it mined edgier territory and stuck to its guns, it would've proven a more engaging vehicle than the mild laugher we have here",NEGATIVE
John Wick,As you would expect from former stunt coordinators&#44; the action scenes are dynamic and that might be enough&#44; but the emotional thread that motivates Chapter One is exceptionally constructed&#44; justifying much of the rage and murder&#46;,POSITIVE
John Wick,It is definitely a movie made for a particular audience&#44; and if wall-to-wall action and stylized violence isn it your cup of tea&#44; neither is &#8220;John Wick&#8221;&#46;,POSITIVE
John Wick,For all of its familiar plot elements&#44; the movie knows when to step back&#44; let Keanu do his thing&#44; and watch the impressive fight and gunplay choreography throughout&#46;,POSITIVE
John Wick,The directors find new ways to stage and frame these deadly encounters in a way that constantly feels fresh and exciting.,POSITIVE
Johnny English,Right down there with the worst of Peter Sellers' Pink Panther quickies.,NEGATIVE
Johnny English,"Johnny English is more I Spy than the genuine genius of Austin Powers. It ain't great, but it's funny because he's funny.",NEGATIVE
Johnny English,The spy parts aren't exciting enough and the funny parts aren't funny enough.,NEGATIVE
Johnny English,"While it lives up to the very definition of 'hit and miss', the parts that hit are very funny.",POSITIVE
Johnny English Reborn,An unnecessary sequel to a mostly forgettable film.,NEGATIVE
Johnny English Reborn,"If the troubled Bond franchise needs inspiration on how to reinvent itself, it could do worse than to look to Johnny English Reborn. The secret is not to take it so seriously.",POSITIVE
Johnny English Reborn,"Johnny English Reborn is amusing in parts and arguably better than the original, but ultimately it is a throwaway giggle for kids and indulgent parents.",NEGATIVE
Johnny English Reborn,Half-assed spoofs like this just don't work and come off as rather lazy and lame.,NEGATIVE
Johnson Family Vacation,This charmless movie not for children.,NEGATIVE
Johnson Family Vacation,"Mechanical performances by Vanessa Williams and Bow Wow, as Nate's musically inclined son, impair Cedric's earnest comedic efforts in this spasmodic comedy.",NEGATIVE
Johnson Family Vacation,"I really wanted to like this movie, especially since I'm a fan of Cedric the Entertainer.",NEGATIVE
Johnson Family Vacation,...Cedric the Entertainer simply cannot act.,NEGATIVE
Jojo Rabbit,Delightfully one of the year’s best films.,POSITIVE
Jojo Rabbit,Much of the comedy is too broad to truly satirise the subject matter&#46;&#46;&#46; unable to nail the emotional beats when it finally confronts the true reality and horror of the situation&#46;,NEGATIVE
Jojo Rabbit,The film is ability to make you laugh&#44; cry&#44; or be utterly appalled is one of its many strengths&#46;,POSITIVE
Jojo Rabbit,This was the movie that made me laugh and cry the most in 2019&#46; It created this absolutely perfect mixture between satire and drama&#46; Every joke hits all the good spots&#46; Waititi's best work&#63; Probably&#46; &#91;Full review in Spanish&#93;,POSITIVE
Joshua,Far from perfect. But Joshua regards the creepy factor in a realistic setting. Everything that happens is uncannily possible. [Full review in Spanish].,POSITIVE
